{
    "$schema": "./settings.schema.json",
    "tenant": {
        "tenantId": "00000000-0000-0000-0000-000000000000",
        "tenantName": "contoso.onmicrosoft.com"
    },
    "authentication": {
        "mode": "interactive",
        "clientId": null,
        "clientSecret": null,
        "environment": "Global"
    },
    "options": {
        "dryRun": false,
        "create": true,
        "delete": false,
        "force": false,
        "verbose": true
    },
    "imports": {
        "openIntuneBaseline": true,
        "complianceTemplates": true,
        "appProtection": true,
        "notificationTemplates": true,
        "enrollmentProfiles": true,
        "dynamicGroups": true,
        "staticGroups": true,
        "deviceFilters": true,
        "conditionalAccess": true,
        "mobileApps": true,
        "cisBaselines": false,
        "linuxScripts": true
    },
    "mobileApps": {
        "presetId": null,
        "templateIds": [],
        "remediation": {
            "enabled": true
        }
    },
    "platforms": [
        "All"
    ],
    "reporting": {
        "outputPath": "./Reports",
        "formats": [
            "markdown",
            "json"
        ]
    }
}
